{
  "$schema": "https://json-schema.org/draft/2020-12/schema",
  "$id": "https://poetrycollection.invalid/schema/content.schema.json",
  "title": "PoetryCollection 内容产物 dist/content.json",
  "description": "契约 docs/design/content-contract.md 第 2 节的机器可校验形式。sopho 契约线 C 维护：结构随 formatVersion=3 冻结；结构不兼容变更时新开格式版本并同步两端。",
  "type": "object",
  "additionalProperties": false,
  "required": ["formatVersion", "contentVersion", "generatedAt", "dynasties", "tags", "poems"],
  "properties": {
    "formatVersion": {
      "description": "JSON 结构版本。结构不兼容变更时递增；旧客户端遇到更高值必须保留旧内容、不去解析。2 → 3 的变化：新增 poems[].tags[]（{id, orderInTag}，诗句所属标签与标签内位置）与顶层 tags[]（{id, members}，编译期从诗归属汇总、标签之间按拼音、members 按 orderInTag 升序）。不发布任何 SortKey。",
      "const": 3
    },
    "contentVersion": {
      "description": "内容版本。发布版本 YYYY.MM.DD.N，单调递增；本地派生版本 0.0.0-dev+<sha256 前 12 位>，仅供本地/测试。比较规则见契约第 4 节。",
      "type": "string",
      "pattern": "^(?:\\d{4}\\.\\d{2}\\.\\d{2}\\.\\d+|0\\.0\\.0-dev\\+[0-9a-f]{12})$"
    },
    "generatedAt": {
      "description": "UTC 生成时间（秒精度 ISO-8601，Z 结尾）。可被 SOURCE_DATE_EPOCH 固定以复现。",
      "type": "string",
      "pattern": "^\\d{4}-\\d{2}-\\d{2}T\\d{2}:\\d{2}:\\d{2}Z$"
    },
    "dynasties": {
      "description": "顶层分组＝**有序中文值数组**（用户 2026-10-15 已定 ①）。只列实际有内容的组，次序即显示次序（注册表 order 升序）；每首诗的 dynasty 必须逐字等于其中一个值。分组权威就是它，不从诗对象拼。",
      "type": "array",
      "minItems": 1,
      "items": { "type": "string", "minLength": 1, "description": "中文朝代组名，如 汉；精确匹配 tools/lib/dynasties.mjs 注册表里的 label" }
    },
    "tags": {
      "description": "顶层标签表＝**编译期从诗的 tags 汇总生成**的有序数组（不是人手写的第二份事实来源）。`tags[].id` 是标签的中文 id（即显示名）；`members` 是该标签下 poemId 的数组，**严格按诗的 orderInTag 升序**。标签之间的次序按中文拼音（Intl.Collator('zh-Hans-CN-u-co-pinyin')，同名用码点序兑底），**只在编译期算一次**：产物里没有 SortKey，客户端照数组次序渲染、**不得重排**。没有标签时是空数组。",
      "type": "array",
      "items": {
        "type": "object",
        "additionalProperties": false,
        "required": ["id", "members"],
        "properties": {
          "id": {
            "type": "string",
            "minLength": 1,
            "pattern": "\\S",
            "description": "标签的中文 id，就是显示名（不另存 name/qualifier/aliases）。"
          },
          "members": {
            "type": "array",
            "minItems": 1,
            "description": "该标签下的诗（poemId），严格按诗的 orderInTag 升序。",
            "items": { "type": "string", "minLength": 1, "description": "诗的 id（即 poems[].id）" }
          }
        }
      }
    },
    "poems": {
      "description": "所有诗。**编译期已排好序**（排序是编译期唯一权威），客户端照数组次序渲染；产物里没有排序字段（含整数 orderInSource 时尤其不必再找排序字段）。排序策略：组序由每首 dynasty 的注册表 order 决定；组内先按底本原次序 orderInSource（有值者升序），无值者再按作者拼音 → 诗名拼音（佚名最后）。",
      "type": "array",
      "minItems": 1,
      "items": {
        "type": "object",
        "additionalProperties": false,
        "required": [
          "id",
          "title",
          "author",
          "dynasty",
          "genre",
          "source",
          "orderInSource",
          "detail",
          "stanzas",
          "notes",
          "tags"
        ],
        "properties": {
          "id": {
            "type": "string",
            "pattern": "^[^/\\\\\\u0000-\\u001f\\u007f]+$",
            "description": "全局唯一，等于内容根（content/poems/）下的相对路径去 .md、/ 统一写成 -。可以含中文；不含 /（路由 /p/<id> 用 [^/]+）与控制字符。用户 2026-10-16 定 C2：直接换、不做兼容。"
          },
          "title": { "type": "string", "minLength": 1, "pattern": "\\S" },
          "author": { "type": "string", "minLength": 1, "pattern": "\\S", "description": "佚名/未知作者写 佚名，不编造人名" },
          "dynasty": { "type": "string", "minLength": 1, "description": "单一中文朝代组名；必须逐字等于顶层 dynasties 数组里的某个值（注册表精确匹配，不做别名）" },
          "genre": { "type": ["string", "null"], "description": "体裁，可空" },
          "source": { "type": "string", "minLength": 1, "pattern": "\\S", "description": "可核的底本/校录来源" },
          "orderInSource": {
            "type": ["integer", "null"],
            "minimum": 1,
            "description": "作品在底本中的原次序（1 起）；可选，未写则为 null。source 排序策略下它在组内最先比较。"
          },
          "detail": {
            "type": ["string", "null"],
            "description": "考据/详情节正文（来自源的 `## 详情` 节），最小 Markdown 文本；空节或没有该节 ⇒ null（键仍在）。"
          },
          "stanzas": {
            "type": "array",
            "minItems": 1,
            "description": "分段数组，内层为行数组；空行→段边界，原文空行信息不丢。正文不走 Markdown。",
            "items": {
              "type": "array",
              "minItems": 1,
              "items": { "type": "string", "minLength": 1, "pattern": "\\S" }
            }
          },
          "notes": {
            "type": ["string", "null"],
            "description": "用户个人笔记（来自源的 `## 笔记` 节，最小 Markdown 文本）或 null；客户端按需展开，默认折叠；null 时整块不出现。"
          },
          "tags": {
            "type": "array",
            "description": "这首诗所属的标签（源里的 `tags`）。**总是一个数组**：没写 tags ⇒ []（不是 null）。元素 { id, orderInTag }；orderInTag 是该标签内的位置，必填、不可 null（缺失/非整数 ⇒ 编译失败 TAG_ORDER_REQUIRED；同一标签内同序 ⇒ TAG_ORDER_DUP）。",
            "items": {
              "type": "object",
              "additionalProperties": false,
              "required": ["id", "orderInTag"],
              "properties": {
                "id": {
                  "type": "string",
                  "minLength": 1,
                  "pattern": "\\S",
                  "description": "标签的中文 id，就是显示名。"
                },
                "orderInTag": {
                  "type": "integer",
                  "minimum": 1,
                  "description": "该标签内的位置（≥ 1 的整数，必填）。语义是「在标签里的位置」，不一定是任何选本的编次。"
                }
              }
            }
          }
        }
      }
    }
  }
}
