{
  "formatVersion": 3,
  "contentVersion": "0.0.0-dev+rules-v4",
  "generatedAt": "2026-10-16T00:00:00Z",
  "dynasties": [
    "汉"
  ],
  "tags": [
    {
      "id": "古诗十九首",
      "members": [
        "real-01-full"
      ]
    }
  ],
  "poems": [
    {
      "id": "real-01-full",
      "title": "行行重行行",
      "author": "佚名",
      "dynasty": "汉",
      "genre": "五言古诗",
      "source": "《文选》卷二十九·杂诗上「古诗一十九首」（李善注本）。电子文本：汉典古籍 gj.zdic.net/jibu/1224/34173.html，2026-10-14 访问；以四库全书本《六臣注文选》卷二十九对校。异文校记见 docs/sources/gushi-shijiu-shou.md。",
      "orderInSource": 1,
      "detail": "### 异文\n\n- **游子不顾返** —— 四库全书本《六臣注文选》卷二十九、《玉台新咏》卷一「枚乘杂诗」其三，此句均作「返」；底本（李善注本）作「反」。反、返古通用。\n- **胡马嘶北风** —— 《玉台新咏》宋刻本作「嘶」，见清·纪容舒《玉台新咏考异》卷一（四库全书本）校语：「依，宋刻作嘶。按：此二句乃以一南一北申足『各天一涯』之意，以起下『相去日远』，作依为是。今从文选。」纪昀校正本《玉台新咏》卷一影印本同此校语；二手转录站古文岛亦作「嘶」。底本《文选》李善注本、四库全书本《六臣注文选》、明《诗纪》两刻本均作「依」；宋本影像本工作线未目验。\n- **会面安可期** —— 明·冯惟讷《诗纪》卷二十（汉第十·古诗十九首）于「会面安可知」下出校语「一作期」，另一明刻本《诗纪》卷之十同；底本作「知」。\n\n### 分段依据\n\n底本（《文选》卷二十九李善注本、四库全书本《六臣注文选》、宋刻《玉台新咏》）通篇连排、篇内无空行 ⇒ 依底本不分段（本首正文＝单一 stanza）。",
      "stanzas": [
        [
          "行行重行行，与君生别离。",
          "相去万余里，各在天一涯。",
          "道路阻且长，会面安可知？",
          "胡马依北风，越鸟巢南枝。",
          "相去日已远，衣带日已缓。",
          "浮云蔽白日，游子不顾反。",
          "思君令人老，岁月忽已晚。",
          "弃捐勿复道，努力加餐饭。"
        ]
      ],
      "notes": null,
      "tags": [
        {
          "id": "古诗十九首",
          "orderInTag": 1
        }
      ]
    }
  ]
}
